name,image,time,ingredient,nutrition,categoty,methode
Shredded sprout ‘sort-of-Caesar’ salad,https://images.immediate.co.uk/production/volatile/sites/30/2020/10/Shredded-sprout-sort-of-Caesar-salad-ca22d03.jpg,Prep:30Cook:15plussoaking,"['200g Brussels sprouts, any tough or blemished outer leaves removed ', 'squeeze of lemon juice ', 'handful of dried cranberries, soaked in boiling water for 20 mins ', '2 slices sourdough, torn into bite-sized pieces (about 100g) ', '2 anchovy fillets, torn ', '1 tsp chopped rosemary leaves ', '1 tbsp olive oil ', '1 large egg yolk ', '4 anchovy fillets ', '1 tsp Dijon mustard ', '2 garlic cloves, chopped ', 'a few drops of hot sauce ', 'a few drops of Worcestershire sauce ', '½ tsp red wine vinegar ', 'pinch of caster sugar ', '½ lemon, juiced ', '70ml flavourless oil such as vegetable ', '30ml walnut oil ', '25g grated parmesan, plus extra shaved parmesan to serve ', '1 tbsp olive oil ', '4 smoked streaky bacon rashers, sliced into lardons ', '4 cooked chestnuts, crumbled ', '200g Brussels sprouts, any tough or blemished outer leaves removed ', 'squeeze of lemon juice ', 'handful of dried cranberries, soaked in boiling water for 20 mins ', '2 slices sourdough, torn into bite-sized pieces (about 100g) ', '2 anchovy fillets, torn ', '1 tsp chopped rosemary leaves ', '1 tbsp olive oil ', '1 large egg yolk ', '4 anchovy fillets ', '1 tsp Dijon mustard ', '2 garlic cloves, chopped ', 'a few drops of hot sauce ', 'a few drops of Worcestershire sauce ', '½ tsp red wine vinegar ', 'pinch of caster sugar ', '½ lemon, juiced ', '70ml flavourless oil such as vegetable ', '30ml walnut oil ', '25g grated parmesan, plus extra shaved parmesan to serve ', '1 tbsp olive oil ', '4 smoked streaky bacon rashers, sliced into lardons ', '4 cooked chestnuts, crumbled ']","['  kcal 552  ', '  fat 43g  ', '  saturates 8g  ', '  carbs 22g  ', '  sugars 0g  ', '  fibre 4g  ', '  protein 17g  ', '  salt 2.6g  ']",vegetables,"['Heat the oven to 200C/180C fan/gas 6. First, make the croutons. Combine the sourdough pieces with the anchovies and rosemary in a roasting tin. Drizzle over the oil, season with a little black pepper, then toss to coat evenly. Roast on a high shelf in the oven for 8-10 mins until golden and crisp. Set aside.', 'For the dressing, put the egg yolk, anchovies, mustard and garlic in a small food processor with a pinch of salt, and blitz to a paste. Whisk the hot sauce, Worcestershire sauce, vinegar, sugar and lemon juice together in a small bowl until the sugar has dissolved. Combine the two oils in a small jug. With the food processor running, slowly pour in a quarter of the oil mixture, then add a little of lemon and vinegar mixture, then slowly add another quarter of the oil mixture. Continue to alternate between the oil and the lemon and vinegar mixtures (to keep the dressing from splitting) until you have a thick, creamy dressing. Add the parmesan and blitz again to combine. Taste for seasoning', 'For the bacon and chestnuts, heat the oil in a heavy-based frying pan or skillet, and fry the bacon until starting to crisp up. Once the fat has rendered out from the bacon, add the chestnuts and stir to coat in the bacon fat, frying for a minute more. Remove from the heat and set aside.', 'Using a mandoline or very sharp knife, finely shred the sprouts from the top to the base, then transfer to a large bowl and toss gently with your hands to break up some of the layers. Squeeze over a little lemon juice, then season with a small pinch of salt. Pour over just enough of the dressing to coat the sprouts – you don’t want them to be soggy, so start with a small amount and add more if needed. Drain the rehydrated cranberries and toss these through the sprouts, along with half the bacon and chestnut mixture and half the croutons. Transfer the salad to a large serving platter, or divide between plates or bowls. Top with the remaining croutons, bacon and chestnuts, then scatter over the shaved parmesan to serve.', 'Heat the oven to 200C/180C fan/gas 6. First, make the croutons. Combine the sourdough pieces with the anchovies and rosemary in a roasting tin. Drizzle over the oil, season with a little black pepper, then toss to coat evenly. Roast on a high shelf in the oven for 8-10 mins until golden and crisp. Set aside.', 'For the dressing, put the egg yolk, anchovies, mustard and garlic in a small food processor with a pinch of salt, and blitz to a paste. Whisk the hot sauce, Worcestershire sauce, vinegar, sugar and lemon juice together in a small bowl until the sugar has dissolved. Combine the two oils in a small jug. With the food processor running, slowly pour in a quarter of the oil mixture, then add a little of lemon and vinegar mixture, then slowly add another quarter of the oil mixture. Continue to alternate between the oil and the lemon and vinegar mixtures (to keep the dressing from splitting) until you have a thick, creamy dressing. Add the parmesan and blitz again to combine. Taste for seasoning', 'For the bacon and chestnuts, heat the oil in a heavy-based frying pan or skillet, and fry the bacon until starting to crisp up. Once the fat has rendered out from the bacon, add the chestnuts and stir to coat in the bacon fat, frying for a minute more. Remove from the heat and set aside.', 'Using a mandoline or very sharp knife, finely shred the sprouts from the top to the base, then transfer to a large bowl and toss gently with your hands to break up some of the layers. Squeeze over a little lemon juice, then season with a small pinch of salt. Pour over just enough of the dressing to coat the sprouts – you don’t want them to be soggy, so start with a small amount and add more if needed. Drain the rehydrated cranberries and toss these through the sprouts, along with half the bacon and chestnut mixture and half the croutons. Transfer the salad to a large serving platter, or divide between plates or bowls. Top with the remaining croutons, bacon and chestnuts, then scatter over the shaved parmesan to serve.']"
Halloumi fajitas,https://www.bbcgoodfoodme.com/assets/legacy/recipe/recipe-image/2020/07/halloumi-fajitas.jpg,Prep:15Cook:25,"['2 x 225g blocks light halloumi', '2 tbsp olive oil', '1 red onion, halved and sliced', '2 mixed peppers, sliced', '2 garlic cloves, crushed', '2 tsp smoked paprika', '1 tsp ground coriander', '1 lime, juiced', '8 small or 4 large tortilla wraps (use corn or flour)', '1 avocado, stoned, peeled and sliced', 'small handful of coriander leaves', 'chilli sauce or soured cream, to serve (optional)']","['  kcal 692  ', '  fat 36g  ', '  saturates 18g  ', '  carbs 51g  ', '  sugars 10g  ', '  fibre 7g  ', '  protein 38g  ', '  salt 4.1g  ']",vegetables,"['Split each halloumi block through the middle lengthways (they should have a natural seam). Cut each half into four strips. Heat half the oil in a frying pan over a medium heat, and fry the halloumi strips for a few minutes on each side until golden. Transfer to a plate and set aside.', 'Heat the remaining oil in the pan over a high heat, and fry the onion and peppers for 5 mins until just soft and starting to char. Add the garlic, paprika and coriander with some seasoning and cook for 1 min more. Pour in the lime juice and fried halloumi, and stir very gently so the halloumi doesn’t break up. Will keep at room temperature for a few hours. Reheat over a low heat with a little water.', 'Warm the wraps in a low oven wrapped in foil. Alternatively, warm two at a time for 10 seconds in the microwave (not wrapped in foil), or by holding them directly over a gas flame with a pair of tongs (this will give you flavourful charred edges).\xa0', 'Pile the halloumi filling into the warm wraps, with a few slices of avocado each, some coriander leaves, and spoonfuls of chilli sauce or soured cream, if you like.']"
Crispy grilled feta with saucy butter beans,https://www.bbcgoodfoodme.com/assets/legacy/recipe/recipe-image/2020/07/crispy-grilled-feta-with-saucy-butter-beans.jpg,Prep:2Cook:18,"['500ml passata', '2 x 400g cans butter beans, drained and rinsed', '2 garlic cloves, crushed', '1 tsp dried oregano, plus a pinch', '200g spinach', '2 roasted red peppers, sliced', '1/2 lemon, zested and juiced', '100g block of feta, cut into chunks', '1/2 tsp olive oil', '4 small pittas']","['  kcal 506  ', '  fat 9g  ', '  saturates 4g  ', '  carbs 69g  ', '  sugars 10g  ', '  fibre 18g  ', '  protein 28g  ', '  salt 1.3g  ']",vegetables,"['Put a large ovenproof frying pan over a medium-high heat, and tip in the passata, butter beans, garlic, oregano, spinach and peppers. Stir together and cook for 6-8 mins until the sauce is bubbling and the spinach has wilted. Season, then add the lemon juice.', 'Heat the grill to high. Scatter the feta over the sauce, so it’s still exposed, drizzle with the olive oil and sprinkle over the lemon zest plus a pinch of oregano, then grind over some black pepper. Grill for 5-8 mins until the feta is golden and crisp at the edges.', 'Meanwhile, toast the pittas under the grill or in the toaster, then serve with the beans and feta.']"
Baked courgette & tomato gratin,https://www.bbcgoodfoodme.com/assets/legacy/recipe/recipe-image/2020/06/courgette-and-tomato-gratin.jpg,Prep:20Cook:50,"['2 medium courgettes, sliced lengthways about ½cm thick', '1 tbsp olive oil, plus extra for the dish and for drizzling', '400g can chopped tomatoes, blitzed in a food processor', '1 garlic clove, finely chopped', 'handful of fresh basil (optional)', '50g polenta or semolina flour', '50g plain flour', '1 large egg, beaten', '1 ball of mozzarella, sliced (225g)', '10g parmesan or vegetarian alternative, grated', '50g breadcrumbs']","['  kcal 427  ', '  fat 23g  ', '  saturates 10g  ', '  carbs 33g  ', '  sugars 6g  ', '  fibre 3g  ', '  protein 20g  ', '  salt 0.8g  ']",vegetables,"['Sprinkle the courgettes with a pinch of sea salt flakes and lay them on a plate with another plate on top. Put a weight or tin on top to help push out the liquid.', 'Heat 1 tbsp olive oil in a non-stick frying pan and add the tomatoes and garlic. Cook over a medium heat, stirring, for 5 mins until thickened. Tear in the basil, if using, and season. ', 'Heat the oven to 200C/180C fan/gas 6 and oil a roasting dish. Combine the flours in a bowl. Pour away the water from the courgette. Dip the courgette slices into the egg, then into the flour, and arrange in a layer over the bottom of the dish. Top with a few slices of mozzarella, followed by a layer of the tomato sauce, and repeat with another layer of courgette, mozzarella and sauce. Toss the cheese and breadcrumbs together, then scatter over the top.', 'Drizzle with a little more olive oil, and bake for 40-45 mins until golden and bubbling. Serve with a herby red onion salad and some bread to mop it up, if you like. Can be frozen for up to two months.']"
Courgette & broad bean risotto with basil pesto,https://www.bbcgoodfoodme.com/assets/legacy/recipe/recipe-image/2020/06/courgette-and-broad-bean-risotto.jpg,Prep:25Cook:30,"['3 tbsp olive oil', '1 tsp butter', '2 medium courgettes (about 350g), cut into 1-2cm dice', 'pinch of chilli flakes or pul biber', 'pinch of grated nutmeg', '2 spring onions, finely sliced', '½ lemon, zested', '150g risotto rice', '75ml dry white wine or vermouth', '750g warm vegetable or chicken stock', '80g broad beans, blanched and peeled', 'courgette flowers, stamen removed and petals torn (optional)', '20g parmesan or vegetarian alternative, grated, plus extra to serve', '1 garlic clove', '1 tbsp toasted pine nuts', 'large handful of basil leaves, plus extra to serve', 'handful of mint leaves', '1 tbsp olive oil', '1 tbsp grated parmesan or vegetarian alternative']","['  kcal 698  ', '  fat 31g  ', '  saturates 8g  ', '  carbs 69g  ', '  sugars 5g  ', '  fibre 8g  ', '  protein 25g  ', '  salt 2.4g  ']",vegetables,"['To make the pesto, crush the garlic to a paste with a pinch of salt using a pestle and mortar. Add the pine nuts and pound to a coarse paste, then tear in the basil and mint, pounding again until they’ve broken down. Stir in the oil and cheese, then taste for seasoning – add more cheese if you like.', 'Heat the oil and butter in a large non-stick frying pan over a medium heat. Add the courgettes, sprinkle in the chilli flakes and nutmeg, and season with salt and pepper. Fry for 3-5 mins until the courgettes are golden and softened. Add the spring onions and lemon zest, and stir for a minute or two. Tip in the rice and stir to coat in the oil until translucent, about 2 mins. ', 'Pour in the wine, then cook for a couple of minutes until it’s mostly evaporated. Add a ladleful of the stock and stir for a few minutes until it’s absorbed. Continue adding a ladleful at a time for 20-30 mins, stirring continually, until all of the stock is absorbed.', 'Stir in the blanched broad beans and flowers, if using, and warm through for 2 mins. Remove from the heat and stir through the parmesan. Allow to sit for about 5 mins, then swirl through half of the pesto. Any remaining pesto will keep chilled for up to two days.', 'Divide the risotto between bowls and scatter with the extra basil leaves, extra cheese and another spoonful of the pesto, if you like.']"
"Sesame, halloumi & courgette fritters with chilli honey drizzle",https://www.bbcgoodfoodme.com/assets/legacy/recipe/recipe-image/2020/06/courgettes_fritters.jpg,Prep:15Cook:8plusdraining,"['2 medium courgettes, grated', '½ tsp sea salt, plus extra to serve', '30g self-raising flour', '20g rice or cornflour', '2 tbsp toasted sesame seeds', '¼ tsp ground white pepper', '2 tsp mint leaves, finely chopped', '80g halloumi, grated', '2 large eggs', '2 spring onions, finely sliced', 'vegetable oil, for frying', '2 tbsp honey', '½ tsp pul biber or other chilli flakes', '2 lemons, zested']","['  kcal 127  ', '  fat 7g  ', '  saturates 2g  ', '  carbs 10g  ', '  sugars 5g  ', '  fibre 1g  ', '  protein 6g  ', '  salt 0.7g  ']",vegetables,"['To make the chilli honey drizzle, warm the honey, 2 tbsp water, chilli flakes and lemon zest in a small pan until bubbling and syrupy, about 3 mins. Put the courgettes in a sieve and sprinkle over the salt. Allow to drain for 30 mins, then use your hands to squeeze out the liquid – you want them as dry as possible. ', 'Combine the flours, sesame seeds and pepper in a bowl. Add the mint, halloumi and courgette, and toss lightly to combine. Crack in the eggs and use a fork to stir them into the mixture along with the spring onions. Stir until you have a thick batter.', 'Heat 1 tbsp oil in a large, heavy-bottomed non-stick frying pan and swirl to coat the base. Add 2 heaped tbsp of the batter for each fritter, flattening them down with a spatula, and fry for a couple of minutes until golden. Flip them over and press down with the spatula, then fry for another few minutes until golden and cooked all the way through. Drain on kitchen paper and season with a few flakes of sea salt. Drizzle with the chilli honey to serve.']"
Greek bouyiourdi,https://www.bbcgoodfoodme.com/assets/legacy/recipe/recipe-image/2020/05/greek-bouiyourdi.jpg,Prep:10Cook:30,"['3 large ripe tomatoes', '1 garlic clove, crushed', '200g block feta', '1 large mild green chilli, or 1 green pepper, sliced', '1 tsp roughly chopped oregano leaves', '4 tbsp olive oil', 'warmed pitta breads, to serve']","['  kcal 243  ', '  fat 21g  ', '  saturates 8g  ', '  carbs 4g  ', '  sugars 4g  ', '  fibre 1g  ', '  protein 8g  ', '  salt 1.3g  ']",vegetables,"['Cut 1 tomato through the middle, then cut two slices from the centre and set aside. Scoop the seeds from the rest of the tomato, then grate the flesh, discarding the skin. Deseed and grate the rest of the tomatoes in the same way, then mix the grated flesh with the garlic. Season and spoon into a 16cm baking dish.', 'Heat the oven to 200C/180C fan/gas 6. Nestle the feta block in the garlicky tomatoes, then top with the sliced tomatoes, the chilli, oregano, olive oil and a pinch of sea salt. Cover the dish and bake for 15 mins, then uncover and bake for a further 15 mins. Serve warm with the pitta breads on the side for dunking.']"
Edamame falafel wraps,https://www.bbcgoodfoodme.com/assets/legacy/recipe/recipe-image/2020/05/edamame-falafel-wraps.jpg,Prep:20Cook:20,"['100g frozen edamame beans', '400g can chickpeas, drained', '1 small garlic clove, chopped', '1 tsp ground cumin', 'small handful of parsley, roughly chopped, plus extra to serve (optional)', '1 tbsp plain flour', '1 tbsp olive oil, plus extra for rolling and brushing', '¼ red cabbage, finely shredded', '½ lemon, juiced', '4 flatbreads or wraps', '4 tbsp hummus', '¼ cucumber, chopped', '1 red chilli, thinly sliced (optional)']","['  kcal 433  ', '  fat 15g  ', '  saturates 3g  ', '  carbs 52g  ', '  sugars 4g  ', '  fibre 11g  ', '  protein 18g  ', '  salt 1g  ']",vegetables,"['Heat the oven to 190C/170C fan/gas 5. Line a baking tray with baking parchment. Put all the falafel ingredients, except the oil, in a blender and season lightly. Blend until you have a smooth mixture – a few chunks of edamame are fine. ', 'With oiled hands, scoop up tablespoon-sized portions of the mixture, roll into balls (you should get 16) and put on the baking tray. Gently press down each falafel with the palm of your hand. Brush each falafel with a little oil, then bake for 20 mins until firm and golden.', 'Mix the cabbage with a pinch of salt and the lemon juice, and set aside for 5 mins to pickle. Warm the wraps and spread with hummus. Top with the cabbage, falafel (5 each for adults, 3 for children), cucumber, extra parsley, if using, and chilli for those who don’t mind spicy food.']"
"Sweet potato, spinach & feta tortilla",https://www.bbcgoodfoodme.com/assets/legacy/recipe/recipe-image/2020/05/sweet-potato-spinach-feta-tortilla.jpg,Prep:5Cook:20,"['3 sweet potatoes', '2 tbsp olive oil', '100g baby spinach', '6 large eggs', '100g feta, crumbled']","['  kcal 572  ', '  fat 25g  ', '  saturates 9g  ', '  carbs 59g  ', '  sugars 31g  ', '  fibre 10g  ', '  protein 23g  ', '  salt 1.6g  ']",vegetables,"['Pierce the potatoes a few times on each side. Microwave on high for 5-8 mins until soft, then set aside to cool a little.', 'Heat the oil in a 20cm ovenproof frying pan and wilt the spinach for a minute or two (you might have to do this in batches). Cut each potato in half lengthways and use a spoon to scoop out the flesh, keeping it in big chunks. Whisk the eggs.', 'Add the sweet potato to the pan and stir to combine with the spinach – don’t break it up too much. Pour in the egg and swirl around so it fills any gaps in the pan. Scatter over the feta and cook for 4-5 mins over a low heat until the bottom and sides are set.', 'Place under the grill for 1-2 mins to cook the top – poke a knife into the centre to ensure it’s cooked through. Cool before slicing into wedges. Will keep chilled for up to a day.']"
Hummus rainbow wraps,https://www.bbcgoodfoodme.com/assets/legacy/recipe/recipe-image/2020/05/houmous-rainbow-wrap.jpg,Prep:15Nocook,"['3-4 wraps (½ a wrap will be enough for a smaller child)', '6 tbsp hummus', '2 carrots, grated', '4 cooked beetroot, grated', 'large handful of baby spinach', '100g feta, crumbled (optional)']","['  kcal 286  ', '  fat 8g  ', '  saturates 2g  ', '  carbs 40g  ', '  sugars 14g  ', '  fibre 9g  ', '  protein 9g  ', '  salt 1g  ']",vegetables,"['Spread the wraps with the hummus, then fill with the carrot, beetroot, spinach and feta, for those who want it. Wrap and save for lunchtime or eat straightaway.']"
Pesto chicken salad,https://www.bbcgoodfoodme.com/assets/legacy/recipe/recipe-image/2020/05/_pesto-chicken-salad.jpg,Prep:20Nocook,"['50g couscous', '2 tbsp pesto', '2 tbsp fat-free yogurt', '2 cooked skinless chicken breasts, shredded, or 200g leftover roast chicken, shredded', '½ small bunch of basil, leaves picked and torn, plus a few small leaves to serve', '½ cucumber, chopped', '2 sundried tomatoes in oil, drained and sliced', '2 Little Gem lettuces, leaves separated', '2 tsp toasted pine nuts']","['  kcal 467  ', '  fat 15g  ', '  saturates 2g  ', '  carbs 36g  ', '  sugars 9g  ', '  fibre 6g  ', '  protein 44g  ', '  salt 0.6g  ']",vegetables,"['Put the couscous in a large heatproof bowl and cover with 100ml boiling water. Stir in 1 tbsp pesto. Cover and leave for 8 mins. ', 'Fluff the couscous with a fork, then stir in the rest of the pesto, the yogurt and some seasoning. Toss in the chicken, basil, cucumber and tomatoes.', 'Spoon the couscous mix into the lettuce leaves and eat with your fingers, or serve over the lettuce like a salad. Scatter over the pine nuts and more basil before serving.']"
Beetroot burger,https://www.bbcgoodfoodme.com/assets/legacy/recipe/recipe-image/2020/05/cant-believe-its-vegan-burger.jpg,Prep:30Cook:40pluschillingandoptionalfreezing,"['1 onion, quartered', '3 tbsp olive oil, plus extra for brushing', '2 garlic cloves, crushed', '200g chestnut mushrooms', '250g smoked or regular tofu', '2 (about 100g) cooked beetroot (not in vinegar)', '400g can black beans, drained', '1 tbsp tomato purée', '2 tbsp vegan mayonnaise', '1 tbsp miso paste', '100g oat flour', '2 tbsp ground flaxseed', '50g pecans', '200g pouch microwave brown rice, cooked', '8 cheese slices, vegan if needed (optional)', '8 burger buns, split (check the label, if catering for vegans)', 'tomato chilli jam (see recipe, below)', 'a few crunchy lettuce leaves', '1 avocado, stoned, peeled and roughly mashed', '½ lime, juiced']","['  kcal 291  ', '  fat 17g  ', '  saturates 2g  ', '  carbs 21g  ', '  sugars 3g  ', '  fibre 6g  ', '  protein 12g  ', '  salt 0.5g  ']",vegetables,"['Put the onion in a food processor and pulse until it resembles rice. Heat 1 tbsp oil in a large frying pan, tip in the onion and fry for 10 mins until soft and just golden. Stir in the garlic and fry for 1 min more. Tip the mixture into a large bowl.', 'Put the mushrooms in the food processor and pulse until they also resemble rice. Heat the remaining oil in the pan, add the mushrooms and fry for 10-15 mins, until any liquid that’s released has evaporated and the mushrooms are tender. Tip into the bowl with the onions.', 'Put the tofu, beetroot, beans, tomato purée, mayonnaise, miso, flour and flaxseed in the food processor with some seasoning and blitz until smooth. Scrape into the bowl with the veg. Add the pecans and half the rice to the food processor and pulse until finely chopped, or a little chunkier, if you prefer. Tip into the bowl with the veg and tofu mixture, along with the rest of the rice.', 'Use your hands to shape the mixture into patties roughly the same size as your burger buns. The patties will be delicate, so chill for at least 30 mins before cooking. If you want to barbecue them, freeze for 30-45 mins first until firm.', 'Heat a frying pan over a medium heat or light the barbecue, and brush both sides of the patties with a little oil. Cook for 5-8 mins on each side, turning once after a crust has formed, until charred and hot through to the centre. Avoid moving or turning too often, as they will be more delicate than meat patties. Top with the cheese, if using, for the final minute or so (see tip, below). Toast the buns on the barbecue or in the pan, then spread each with a little chilli jam. Fill with a few lettuce leaves, the patties and some smashed avocado mixed with a squeeze of lime.']"
Vegan burger,https://www.bbcgoodfoodme.com/assets/legacy/recipe/recipe-image/2020/05/vegan-burger.jpg,Prep:10Cook:10plusdryingtime,"['1 shallot or ½ onion, chopped', '1 stick of celery, or ¼ red pepper, chopped', 'handful of parsley leaves', '400g can chickpeas, drained and left to dry a little', '1-2 tsp garam masala', '1 tbsp tomato purée', '2 tbsp plain flour', '1 tbsp polenta, couscous, or dried breadcrumbs', 'oil, for frying', 'burger buns or pitta bread, lettuce, tomato, and sauces to serve']","['  kcal 190  ', '  fat 8g  ', '  saturates 1g  ', '  carbs 21g  ', '  sugars 1g  ', '  fibre 5g  ', '  protein 6g  ', '  salt 0.04g  ']",vegetables,"['Whizz the shallot, celery, parsley and most of the chickpeas to a coarse paste. Don’t overdo this, you want a texture slightly rougher than hummus. Mash the remaining chickpeas and stir them into the paste with the garam masala, tomato purée, flour and polenta. Season well. ', 'Shape the mixture into four patties. Let them rest for at least 30 mins – you can leave them overnight in the fridge if you like. The polenta needs time to absorb any extra liquid.', 'Heat a little oil in a non-stick frying pan and cook the patties until they’re brown and crisp on each side. Try not to handle them too much as they’ll be quite soft when warm. Slide into buns or pitta with the accompaniments that you’d like.']"
Halloumi skewers,https://www.bbcgoodfoodme.com/assets/legacy/recipe/recipe-image/2020/05/halloumi-skewers.jpg,Prep:10Cook:5,"['500g halloumi', 'your chosen glaze (optional)']","['  kcal 390  ', '  fat 29g  ', '  saturates 21g  ', '  carbs 2g  ', '  sugars 2g  ', '  fibre 0g  ', '  protein 29g  ', '  salt 3.8g  ']",vegetables,"['Slice the halloumi into large chunks and thread onto three skewers. Light the barbecue. Brush the skewers with your chosen glaze and, when the flames have died down, cook for 1-2 mins on each side (or, cook in a griddle pan set over a high heat). Brush with the remaining glaze and cook for another 1 min on each side.']"
