name,image,time,ingredient,nutrition,categoty,methode
Orecchiette with purple sprouting broccoli & Calabrian pesto,https://images.immediate.co.uk/production/volatile/sites/30/2021/03/Orecchiette-with-purple-sprouting-broccoli-and-Calabrian-pesto-be72983.jpg,Prep:20Cook:35,"['400g purple sprouting broccoli ', '5 tbsp extra virgin olive oil ', '375g orecchiette or other pasta shapes ', 'grated parmesan or pecorino (or vegetarian alternative), to serve ', '3 tbsp extra virgin olive oil ', '½ small red onion, chopped ', '1 plum tomato, chopped ', '75g aubergine, cut into small chunks ', '125g roasted peppers from a jar, drained ', '1 garlic clove, chopped ', '1 red chilli, halved, deseeded and chopped (leave the seeds in if you want a more fiery pesto) ', '40g blanched almonds, lightly toasted in a dry pan ', '60g ricotta ', '10g basil or parsley leaves ']","['  kcal 463  ', '  fat 21g  ', '  saturates 3g  ', '  carbs 50g  ', '  sugars 0g  ', '  fibre 7g  ', '  protein 14g  ', '  salt 0.1g  ']",vegetables,"['First, make the base of the pesto. Heat 1 tbsp of the olive oil in a frying pan and add the onion, tomato and aubergine. Fry over a medium-low heat for 8-10 mins until the onion is pale gold and the tomatoes and aubergine are soft. Add the peppers and cook for a couple of minutes, then add the garlic and chilli, and cook for another 2 mins. Transfer to a plate and leave to cool.', 'Heat the oven to 190C/170C fan/gas 5. Trim the broccoli at the base, then halve any large pieces lengthways. Put in a roasting tin, drizzle with the olive oil and season. Add the garlic and turn everything using your hands – make sure the garlic is under the broccoli so it will toast without burning. Cook in the oven for 15-20 mins (check on it during cooking for doneness).', 'Meanwhile, cook the pasta in boiling salted water until al dente. It usually takes a little less time than it says on the packet.', 'For the pesto, tip everything on the plate into a food processor along with the almonds and the remaining 2 tbsp extra virgin olive oil. Season and pulse to blend everything together. Stir in the ricotta and taste for seasoning. Tear the basil and stir that in too.', 'Drain the pasta and toss it with the broccoli (including the garlicky juices from the roasting tin) then use as much of the pesto as it takes to coat the pasta and serve the rest on the side. Grind over some black pepper and serve immediately with the grated cheese.']"
Pasta alla norma,https://images.immediate.co.uk/production/volatile/sites/30/2021/03/Pasta-Alla-Norma-f189a02.jpg,Prep:10Cook:1hrsplusdraining,"['2 aubergines, cut into 3cm chunks ', '1 heaped tsp salt ', '4 tbsp extra virgin olive oil ', '1 small onion, finely chopped ', '2 garlic cloves, crushed ', 'pinch chilli flakes ', '2 x 400g tins chopped tomatoes ', '1 tsp sugar ', '350g spaghetti (egg-free, if needed) ', 'small bunch basil, shredded, plus a few leaves to serve ', '1 heaped tbsp capers ', 'ricotta salata or parmesan, finely grated, to serve (optional) ']","['  kcal 517  ', '  fat 13g  ', '  saturates 2g  ', '  carbs 79g  ', '  sugars 0g  ', '  fibre 10g  ', '  protein 15g  ', '  salt 1.7g  ']",vegetables,"['Toss the aubergines with the salt, then tip into a colander set over a bowl for 30 mins, to extract any moisture.', 'Heat 2 tbsp of the oil in a casserole dish or saucepan. Tip in the onion and a pinch of salt, and cook over a low heat for 10 mins. Add the garlic and chilli, and cook for 1 min. Tip in the tomatoes and sugar, and bring to the simmer. Cook, uncovered, for 20 mins, stirring occasionally. Heat the oven to 220C/200C fan/gas 7.', 'Pat the aubergine dry with kitchen paper, then toss with the remaining oil. Spread out on a baking sheet and roast for 25-30 mins until softened and golden around the edges. Meanwhile, cook the pasta following pack instructions, reserving 100ml of the cooking water.', 'Stir the aubergine into the sauce with the basil and capers. Season to taste, then toss the spaghetti in the pan with the sauce and a splash of the pasta water. Divide between four bowls and top with the ricotta and extra basil, if using.']"
Fennel-roasted cauliflower with quinoa,https://images.immediate.co.uk/production/volatile/sites/30/2021/03/Fennel-roasted-cauliflower-with-quinoa-2437e83.jpg,Prep:15Cook:40,"['1 large cauliflower, or 2 small ones, separated into florets ', '1 tbsp fennel seeds ', '1 tsp coriander seeds ', '1 tsp smoked paprika ', '2 tbsp olive oil ', '1 red onion, chopped ', '2 peppers (mix of red, yellow or orange), chopped ', '1 courgette, halved lengthways, cored and chopped ', '1 small garlic clove, crushed ', '1 lemon, juiced and zested ', '4 tbsp yogurt ', '250g quinoa, cooked ']","['  kcal 260  ', '  fat 10g  ', '  saturates 2g  ', '  carbs 27g  ', '  sugars 0g  ', '  fibre 9g  ', '  protein 10g  ', '  salt 0.1g  ']",vegetables,"['Heat the oven to 200C/180C fan/gas 6. Bring a large pan of salted water to the boil and cook the cauliflower for 5 mins. Drain and spread out on a surface so any excess water evaporates.', 'Crush the fennel and coriander seeds using a pestle and mortar and mix with the paprika and a pinch of seasoning Put the cauliflower in a large bowl, drizzle with half the olive oil and sprinkle over the spice mix. Toss the florets to fully coat them.', 'Tip the florets onto a baking tray and space them apart. Put the red onions, peppers and courgettes on a separate baking tray, drizzle with the remaining oil, and cook both for 30-35 mins, turning halfway through so they brown all over and turn slightly crisp in places.', 'Mix the garlic with lemon juice and stir through the yogurt, adding a little extra water to loosen if needed. Stir the roasted onions, peppers and courgettes into the cooked quinoa along with the lemon zest and a pinch of salt.', 'Pile the quinoa salad onto a plate, then top with the cauliflower florets. Drizzle over the garlic yogurt.']"
Cumin-roasted broccoli with preserved lemon yogurt,https://images.immediate.co.uk/production/volatile/sites/30/2021/02/Broccoli-with-lemon-yoghurt-7e28428.jpg,Prep:20Cook:35,"['500g purple sprouting broccoli, trimmed ', '2 tbsp extra virgin olive oil ', '1 tbsp ground cumin ', '2 small slices of stale white bread ', '1 tbsp olive oil ', '1 garlic clove, finely chopped ', '1 tsp sweet smoked paprika ', '1/2 tsp ground cumin ', '1/2 tsp cayenne pepper ', '1 preserved lemon, finely chopped, seeds discarded ', '100g full-fat yogurt ', '1 tbsp finely chopped coriander leaves ', '1 tbsp finely chopped parsley leaves ', '1/2 garlic clove, finely grated ']","['  kcal 130  ', '  fat 8g  ', '  saturates 1g  ', '  carbs 8g  ', '  sugars 0g  ', '  fibre 5g  ', '  protein 6g  ', '  salt 0.1g  ']",vegetables,"['Heat the oven to 200C/180C fan/gas 6. Check the stalks of the broccoli are roughly the same thickness, if not, halve the bigger stems of broccoli lengthways. Rub the broccoli with the oil, then sprinkle over the cumin and some seasoning. Tip onto a baking sheet in a single layer, and roast for about 15-20 mins, or until tender with just a little light charring, turning halfway through.', 'For the breadcrumbs, heat the oven to 180C/160C fan/gas 4. Tear the bread into small pieces and bake for 5 to 10 mins, or until crunchy, then tip into a food processor and blitz into breadcrumbs.', 'Heat the oil in a frying pan over a low heat, then add the garlic, spices, the breadcrumbs and some seasoning. Fry, stirring regularly, for about 5 mins until golden. Transfer to a plate lined with kitchen paper to absorb any excess oil.', 'For the yogurt, mix together all the ingredients and season to taste. Serve the broccoli with the breadcrumbs scattered over and the yogurt on the side for dipping.']"
Squash & halloumi flatbreads with sweet chilli beetroot jam,https://images.immediate.co.uk/production/volatile/sites/30/2021/02/Squash-and-halloumi-flatbreads-b6efd2c.jpg,Prep:20Cook:45,"['1 butternut squash ', '2 tbsp olive oil ', '1 tsp smoked paprika ', '225g halloumi ', '100g baby spinach leaves ', '1 small cooked beetroot (about 125g) ', '3 tbsp brown sugar ', '1 tbsp white wine vinegar ', '1 tsp red chilli flakes ', '1 tsp cumin seeds ', '300g self-raising flour, plus extra for dusting ', '150-200g yogurt ']","['  kcal 673  ', '  fat 22g  ', '  saturates 11g  ', '  carbs 89g  ', '  sugars 0g  ', '  fibre 8g  ', '  protein 26g  ', '  salt 2.5g  ']",vegetables,"['Heat the oven to 200C/180C fan/gas 6. Prepare the squash by halving it, scooping out the seeds, then cutting into 1cm-thick slices. Put in a large bowl with the olive oil, smoked paprika and a pinch of salt. Toss well to coat the squash, then lay on a baking tray and bake at 180C/160C fan/gas 4 for about 40 mins until soft and starting to brown on the surface.', 'For the chilli jam, grate the beetroot (wear gloves to prevent staining your hands) and put in a saucepan with the sugar, vinegar, chilli flakes, cumin seeds and salt to taste. Cook for a few minutes over medium heat until the sugar has dissolved. Remove from the heat and set aside.', 'To make the flatbreads, tip the flour into a bowl and add 150g yogurt, or up to 200g if the dough looks too dry, then mix using a cutlery knife until it comes together into a ball. Tip the dough onto a work surface and knead for 2 mins until smooth. Split into four balls, then dust the work surface with flour and roll each into a large flatbread (or make eight mini ones). Dry-fry the flatbreads in a frying pan on medium heat for a couple of minutes on each side.', 'Just before serving, cut the halloumi into 8 thin slices. Cook in a frying pan for a couple of minutes on each side. Layer the spinach, squash and halloumi on the flatbreads, then drizzle with the beetroot chilli jam to serve.']"
Freezable herby falafel,https://images.immediate.co.uk/production/volatile/sites/30/2021/01/Herby-falafel-8f7577d.jpg,Prep:40Cook:20plusatleast12hrssoakingand45chilling,"['250g dried chickpeas ', '2 tsp coriander seeds, crushed ', '3 tsp ground cumin ', '½ tsp chilli flakes (optional) ', 'pinch of allspice ', '2 large garlic cloves, crushed ', 'small bunch of parsley, leaves picked and roughly chopped ', 'small bunch of coriander, leaves picked and roughly chopped ', '¾ tsp baking powder ', '30g sesame seeds (optional) ', 'sunflower oil, for frying ', 'warmed flatbreads, hummus, pickles, sliced radishes, mint, coriander, tahini, za’atar or chilli flakes and chilli sauce, to serve ']","['  kcal 333  ', '  fat 15g  ', '  saturates 2g  ', '  carbs 30g  ', '  sugars 0g  ', '  fibre 11g  ', '  protein 15g  ', '  salt 2.1g  ']",vegetables,"['Put the chickpeas in a bowl, cover with cold water and leave to soak for at least 12 hrs.', 'The next day, drain the chickpeas and pat dry with kitchen paper. Tip into a food processor and pulse until they begin to break down. Toast all of the spices in a small dry pan for 1-2 mins. Tip these into the food processor with the garlic, herbs and 1½ tsp sea salt. Blitz until smooth and pliable (check this by squeezing a clump in your hand; when ready, it should stay together). Tip the mix into a bowl, stir in the baking powder, cover and chill for 30 mins.', 'Form into 12 small discs, then coat each lightly in the sesame seeds, if using. Chill for 15 mins more. The falafel can now be frozen for up to three months (see below).', 'Heat a 1cm depth of oil in a large non-stick frying pan over a medium heat until small bubbles form on the surface. Fry the falafel in batches for 6 mins until deeply golden, turning over halfway through using a spatula or slotted spoon. Transfer to a plate lined with kitchen paper. Leave to drain. Once cooled, the falafel can be frozen for up to three months (see below). Heat the oven to 220C/200C fan/gas 8. Put the falafel on a lightly oiled baking sheet and brush with some oil. Bake for 15-20 mins until crisp. Serve in the flatbreads with the fillings of your choice.']"
Celery juice,https://images.immediate.co.uk/production/volatile/sites/30/2021/02/Celery-juice-d3680d7.jpg,Prep:10Nocook,"['1 head of celery (about 500g) ', '1 green apple (about 120g), peeled, quartered and cored ', '½-1 lemon, juiced ', '20g ginger, finely grated ']","['  kcal 63  ', '  fat 1g  ', '  saturates 0.1g  ', '  carbs 10g  ', '  sugars 0g  ', '  fibre 5g  ', '  protein 2g  ', '  salt 0.4g  ']",vegetables,"['Separate the celery stalks and wash well. Trim the root ends and roughly chop, keeping one of the tender, young stems whole to serve.', 'Put the chopped celery, apple, half the lemon juice and ginger in a food processor or blender and pulse to finely chop. With the motor running, add 50-100ml cold water and blend until smooth.', 'Strain the juice through a fine mesh sieve into a jug, pressing down with the back of a spoon to extract all the juice. Cover and chill or serve straight away. Stir the juice well, add a squeeze more lemon if you like, and serve in glasses with a piece of the reserved celery stalk.']"
Green bean casserole,https://images.immediate.co.uk/production/volatile/sites/30/2020/10/Green-bean-casserole-813ef09.jpg,Prep:10Cook:1hrs,"['50g butter ', '2 tbsp olive oil ', '250g chestnut or button mushrooms, sliced ', '500g green beans, trimmed ', '50g flour ', '500ml milk ', '100g crispy onions ']","['  kcal 311  ', '  fat 21g  ', '  saturates 7g  ', '  carbs 19g  ', '  sugars 0g  ', '  fibre 3g  ', '  protein 9g  ', '  salt 0.4g  ']",vegetables,"['Heat 1 tbsp of the butter and the oil in a large pan and fry the mushrooms for 10-15 mins until golden. Stir in the green beans and cook for another 3-4 mins until the beans turn bright green. Scoop out the veg onto a plate.', 'Heat the oven to 200C/180C fan/gas 6. Melt the remaining butter in the pan until foaming. Remove from the heat briefly and sprinkle over the flour, stirring into the butter to make a golden brown paste. Return to the heat and add the milk, a splash at a time, continually stirring until all the milk has been added and you get a smooth, thick white sauce. Season well. Stir the beans and mushrooms into the white sauce, and spoon into a medium ovenproof dish.', 'Scatter over the crispy onions, then bake for 20-30 mins until bubbling and golden, covering if the onions brown too quickly.']"
Siberian pelmeni dumplings,https://images.immediate.co.uk/production/volatile/sites/30/2020/09/Siberian-dumplings-dbc7f6a.jpg,Prep:1hrs30Cook:30,"[""350g '00' flour plus extra to dust "", '1 large egg ', '250g lamb mince ', '½ onion, finely chopped ', '1 tsp ground cumin ', '1 tsp ground coriander ', '1 tsp smoked paprika ', '¼ chilli powder ', 'small bunch of dill, finely chopped ', '1 tbsp sunflower oil ', '200g mixed mushrooms, finely chopped ', '½ onion, finely chopped ', '1 garlic clove, finely chopped ', 'small bunch of flat leaf parsley, finely chopped ', 'dash of soy sauce ', '75g pine nuts, finely chopped ', '2 bay leaves ', '1 vegetable stock cube ', 'small bunch of dill, leaves picked ', 'soured cream, to serve ', 'butter, to serve (optional) ']","['  kcal 477  ', '  fat 19g  ', '  saturates 4g  ', '  carbs 52g  ', '  sugars 0g  ', '  fibre 7g  ', '  protein 20g  ', '  salt 1.5g  ']",vegetables,"['To make the dough, sift the flour into a bowl. Make a well in the middle and add a pinch of salt, the egg and 100ml water, gradually mixing the flour into it with your hands to form a firm dough. Knead well for 5-7 mins. Cover and chill for 30 mins. In the meantime prepare your fillings.', 'Thoroughly mix the meat filling ingredients together in a large bowl with a pinch of salt.', 'To make the vegetable filling, heat the oil in a large frying pan and fry the mushrooms, onion, garlic and parsley with the soy sauce for 5 mins. Turn off the heat and stir through the pine nuts and some salt and pepper. Let the mixture cool before handling.', 'Roll the dough out on a lightly floured work surface to 1.5mm-thick sheets. For the best results, use a pasta machine.', 'Cut out discs of the dough that are about 4-6cm in diameter using a shot glass or pastry cutter. Put a teaspoon of filling in the middle of each disc, then use a wet finger to brush lightly onto the dough around the filling. Fold each in half to make a half-moon shape, pressing down to seal. Fold the dumpling again so that the pointed edges of the moon are stuck together. The dumplings can be cooked immediately or frozen in flat layers in freezer bags to be cooked at a later date, using the same method as below but increasing the cooking time by a couple of minutes.', 'To cook, bring about 3 litres of water to the boil in a large saucepan, adding the bay leaves and stock cube. Add the dumplings to the boiling broth in batches of around 10, then cook for 5 mins. They are ready when they float to the surface. The meat ones may take a few minutes more than the veg.', 'Ladle the pelmeni into soup bowls with the cooking broth, topping them with the dill, soured cream and black pepper. If you prefer to have them without the broth, use a slotted spoon to move them to a bowl, adding a generous dollop of butter with the dill, soured cream and black pepper.']"
Creamy baked cauliflower with almond crumbs,https://images.immediate.co.uk/production/volatile/sites/30/2020/10/Creamy-baked-cauliflower-with-almond-crumbs-53db84a.jpg,Prep:15Cook:2hrs,"['1 large cauliflower, outer leaves trimmed ', '4 tbsp rapeseed oil ', '2 onions, very finely chopped ', '3 garlic cloves, crushed ', '½ tsp ground mace ', '4 thyme sprigs, leaves picked from 2, 2 left whole ', '4 tbsp plain flour ', '750ml unsweetened almond milk ', '150ml soya cream ', '1 tbsp wholegrain mustard ', '25g dried breadcrumbs (ensure vegan-friendly, if needed) ', '2 tbsp flaked almonds ', 'vegan garlic bread and a green salad with a lemony dressing, to serve ']","['  kcal 405  ', '  fat 23g  ', '  saturates 2g  ', '  carbs 35g  ', '  sugars 0g  ', '  fibre 7g  ', '  protein 12g  ', '  salt 0.6g  ']",vegetables,"['Heat the oven to 180C/160C fan/gas 4. Cut off enough of the cauliflower stalk so it sits flat, then cut a deep cross in the base of the stalk. Sit the cauliflower on a piece of foil, then rub over 1 tbsp oil. Sprinkle over 2 tbsp water, season well, then cover tightly with the foil, sealing the water and cauliflower inside the package. Put in a baking dish and cook for 1 hr 30 mins.', 'Meanwhile, cook the onions with a pinch of salt and 2 tbsp oil in a pan until soft and translucent. Stir in the garlic, mace, thyme leaves and flour and stir for 2 mins, then add the almond milk. Bring to a simmer, stirring, then season. When slightly thickened, remove from the heat and stir in the soya cream and mustard.', 'Rub the breadcrumbs with the remaining oil. Stir in the almonds.', 'Uncover the cauliflower and return to the dish. Pour the sauce all over the cauliflower and into the dish. Scatter the crumbs on top, and tear over the two whole thyme sprigs. Turn the oven up to 200C/180C fan/gas 6. Bake for 15-20 mins more, until the sauce is bubbling and thickened slightly, and the crumbs and cauliflower are golden. Cut into wedges and serve with a green salad and some garlic bread.']"
"Smoky cod, broccoli & orzo bake",https://images.immediate.co.uk/production/volatile/sites/30/2020/10/Smoky-cod-broccoli-orzo-bake-86cb375.jpg,Prep:10Cook:20,"['½ tbsp olive oil, plus a drizzle ', '1 onion, chopped ', '1 tsp smoked paprika, plus a pinch ', '½-1 tbsp chipotle paste ', '200g long-stem broccoli ', '400ml hot vegetable stock ', '150g orzo ', '½ small bunch of dill, chopped ', '½ small bunch of parsley, chopped ', '50g frozen peas ', '2 sustainable skinless cod fillets ', '4 tbsp fat-free yogurt ']","['  kcal 618  ', '  fat 6g  ', '  saturates 1g  ', '  carbs 78g  ', '  sugars 0g  ', '  fibre 11g  ', '  protein 57g  ', '  salt 1.3g  ']",vegetables,"['Heat the oven to 200C/180C fan/gas 6. Heat the oil in a deep ovenproof frying pan, and fry the onion for 5 mins until tender. Add the paprika, chipotle paste, broccoli and stock. Stir in the orzo, and transfer to the oven for 10 mins.', 'Stir in half the herbs and the peas, and nestle the fish into the orzo. Sprinkle over a pinch of paprika and drizzle with oil, then season. Cook for 8-10 mins until the fish is cooked and the orzo is tender. Mix the remaining herbs with the yogurt. Loosen with a little water if needed, then serve with the orzo and fish.']"
Veg-packed cheeseburgers,https://images.immediate.co.uk/production/volatile/sites/30/2020/10/Secret-Veg-Cheeseburgers-c981dd6.jpg,Prep:20Cook:20,"['2 tbsp vegetable oil ', '1 garlic clove, crushed ', '1 small onion, finely chopped ', '100g courgette, grated ', '1 large carrot, grated ', '50g mushrooms, finely chopped ', '¼ bunch of parsley, finely chopped ', '75g cheddar, grated ', '1 large egg, beaten ', '5 tbsp breadcrumbs ', '250g beef mince ', '4-6 burger buns ', 'lettuce leaves ', 'sliced tomato ', 'sliced red onion ', 'ketchup, mustard and mayo (optional) ']","['  kcal 509  ', '  fat 20g  ', '  saturates 7g  ', '  carbs 55g  ', '  sugars 0g  ', '  fibre 4g  ', '  protein 24g  ', '  salt 1.7g  ']",vegetables,"['Heat 1 tbsp of the oil in a frying pan over a medium heat and cook the garlic, onion, courgette, carrot, mushrooms and parsley with a little seasoning for 8 mins, stirring regularly, until soft. Set aside to cool completely.', 'Mix together the fried veg, cheese, egg, breadcrumbs and beef with a little seasoning until well combined. Form into 4-6 burger-sized patties. Can be frozen for up to two months. Defrost thoroughly before cooking.', 'Heat the remaining vegetable oil in a non-stick frying pan and cook the patties (you may need to do this in batches) for about 3-4 mins on each side until well browned and cooked through.', 'Build the burgers with the remaining ingredients, and any more you fancy.']"
Buffalo cauliflower,https://images.immediate.co.uk/production/volatile/sites/30/2020/10/Buffalo-cauliflower-7825216.jpg,Prep:5Cook:35,"['1 tbsp sweet smoked paprika ', '1/2 tbsp ground cumin ', '1 tsp garlic powder ', '100g plain flour ', '200ml buttermilk or kefir ', '1 head of cauliflower (500g), broken into florets ', '80g hot sauce ', '1½ tbsp maple syrup ', '1 tbsp butter ', 'celery sticks, to serve ', '100g Greek yogurt ', '3 tbsp mayonnaise ', '2 tbsp chopped chives ', '1-2 tbsp milk ']","['  kcal 279  ', '  fat 17g  ', '  saturates 3g  ', '  carbs 23g  ', '  sugars 0g  ', '  fibre 3g  ', '  protein 7g  ', '  salt 1.1g  ']",vegetables,"['Heat the oven to 220C/200C fan/gas 7 and line a baking tray with baking parchment. Mix together the paprika, cumin, garlic powder, flour and ½ tsp salt in a large bowl. Make a well in the centre and whisk in the buttermilk. Tip in the cauliflower and toss to coat. Spread out the cauliflower on the baking tray and cook for 20-25 mins, turning halfway through, until crisp at the edges.', 'Warm the hot sauce, maple syrup and butter in a small pan set over low heat, for 2-3 mins. Liberally brush over the cauliflower and put back in the oven for 8-10 mins.', 'For the ranch dip, whisk together the yogurt, mayo, chives, milk and a pinch of salt in a bowl. Serve the with the cauliflower alongside some celery sticks for dipping.']"
Chilli-butter smashed radishes,https://images.immediate.co.uk/production/volatile/sites/30/2021/02/Chilli-butter-radishes-2f45565.jpg,Prep:5Cook:15,"['100g unsalted butter ', '1 tbsp chilli flakes ', '500g radishes, leaves removed, smashed with the flat edge of a knife (or halved/quartered if you find this hard to do) ', '1/2 lemon, juiced ']","['  kcal 142  ', '  fat 14g  ', '  saturates 9g  ', '  carbs 2g  ', '  sugars 0g  ', '  fibre 1g  ', '  protein 1g  ', '  salt 0.03g  ']",vegetables,"['Heat the butter in a small frying pan with the chilli flakes until it begins to foam and turn golden brown. Add the radishes and coat well in the butter, turning often until softened, about 10-15 mins.', 'Turn up the heat, add the lemon juice, let it sizzle, then season to taste and serve.']"
