name,image,time,ingredient,nutrition,categoty,methode
Cobb salad with buttermilk ranch dressing,https://www.bbcgoodfoodme.com/assets/legacy/recipe_images/recipe-image-legacy-id--851480_10.jpg,Prep:15Nocook,"['2 Baby Gem lettuces, leaves separated', '1 avocado, stoned and sliced', '2 plum tomatoes, chopped', '3 rashers cooked crispy bacon', '140g/5oz cooked turkey breast or chicken, cut into bite-sized pieces', '2 hard-boiled eggs, chopped into chunks', '75ml buttermilk', '2 tbsp light mayonnaise', '1 tbsp white wine vinegar', '1 tbsp chopped dill', '½ garlic clove, crushed']","['  kcal 472  ', '  fat 30g  ', '  saturates 8g  ', '  carbs 8g  ', '  sugars 7g  ', '  fibre 4g  ', '  protein 43g  ', '  salt 2.5g  ']",american,"['In a small bowl, whisk the dressing ingredients together with some salt. Arrange the salad ingredients separately on 2 plates or a platter, and serve with the dressing on the side.']"
Salt beef club with Cajun fries,https://www.bbcgoodfoodme.com/assets/legacy/recipe_images/recipe-image-legacy-id--950601_10.jpg,Prep:10Cook:25,"['1 big potato, cut into thin chips', '2 tsp olive oil', '½ tsp Cajun seasoning', '1 heaped tbsp mayonnaise', '1 tsp chopped chive', '1 tsp Dijon mustard', '3 slices white or brown bread, lightly toasted', '2 radishes, thinly sliced', '1 baby or ½ avocado, sliced', '2 slices salt beef', 'couple Little Gem lettuce leaves']","['  kcal 825  ', '  fat 54g  ', '  saturates 10g  ', '  carbs 63g  ', '  sugars 6g  ', '  fibre 8g  ', '  protein 21g  ', '  salt 2.6g  ']",american,"['Heat oven to 200C/180C fan/gas 6. Place the chips on a non-stick baking tray, toss with oil and Cajun seasoning, then spread out in a single layer. Pop in the oven and bake, turning once, for 20-25 mins or until golden and crisp. Season. ', 'Meanwhile, mix the mayonnaise, chives and mustard in a small bowl and season. Spread the mix onto 2 of the slices of bread. Layer 1 spread slice with radishes and avocado. Place the other slice, spread-side up, on top and add the salt beef and lettuce. Top with the final slice. ', 'Cut up and secure with cocktail sticks if you like, then serve alongside the fries. ']"
Simple seafood chowder,https://www.bbcgoodfoodme.com/assets/legacy/recipe_images/recipe-image-legacy-id--950519_11.jpg,Prep:15Cook:25,"['1 tbsp vegetable oil', '1 large onion, chopped', '100g streaky bacon, chopped', '1 tbsp plain flour', '600ml fish stock, made from 1 fish stock cube', '225g new potatoes, halved', 'pinch mace', 'pinch cayenne pepper', '300ml milk', '320g pack fish pie mix (salmon, haddock and smoked haddock)', '4 tbsp single cream', '250g pack cooked mixed shellfish', 'small bunch parsley, chopped', 'crusty bread, to serve']","['  kcal 422  ', '  fat 19g  ', '  saturates 6g  ', '  carbs 21g  ', '  sugars 9g  ', '  fibre 4g  ', '  protein 41g  ', '  salt 2.3g  ']",american,"['Heat the oil in a large saucepan over a medium heat, then add the onion and bacon. Cook for 8-10 mins until the onion is soft and the bacon is cooked. Stir in the flour, then cook for a further 2 mins. ', 'Pour in the fish stock and bring it up to a gentle simmer. Add the potatoes, cover, then simmer for 10-12 mins until the potatoes are cooked through. ', 'Add the mace, cayenne pepper and some seasoning, then stir in the milk. ', 'Tip the fish pie mix into the pan, gently simmer for 4 mins. Add the cream and shellfish, then simmer for 1 min more. Check the seasoning. Sprinkle with the parsley and serve with some crusty bread.']"
Pumpkin pie,https://www.bbcgoodfoodme.com/assets/legacy/recipe_images/recipe-image-legacy-id--801482_11.jpg,Prep:40Cook:1hrs30Pluschilling,"['750g/1lb 10oz pumpkin or butternut squash, peeled, deseeded and cut into chunks', '350g sweet shortcrust pastry', 'plain flour, for dusting', '140g caster sugar', '½ tsp salt', '½ tsp fresh nutmeg, grated', '1 tsp cinnamon', '2 eggs, beaten', '25g butter, melted', '175ml milk', '1 tbsp icing sugar']","['  kcal 357  ', '  fat 18g  ', '  saturates 7g  ', '  carbs 45g  ', '  sugars 27g  ', '  fibre 2g  ', '  protein 5g  ', '  salt 0.65g  ']",american,"['Place the pumpkin in a large saucepan, cover with water and bring to the boil. Cover with a lid and simmer for 15 mins or until tender. Drain pumpkin; let cool. ', 'Heat oven to 180C/160C fan/gas 4. Roll out the pastry on a lightly floured surface and use it to line a 22cm loose-bottomed tart tin. Chill for 15 mins. Line the pastry with baking parchment and baking beans, then bake for 15 mins. Remove the beans and paper, and cook for a further 10 mins until the base is pale golden and biscuity. Remove from the oven and allow to cool slightly. ', 'Increase oven to 220C/200C fan/gas 7. Push the cooled pumpkin through a sieve into a large bowl. In a separate bowl, combine the sugar, salt, nutmeg and half the cinnamon. Mix in the beaten eggs, melted butter and milk, then add to the pumpkin purée and stir to combine. Pour into the tart shell and cook for 10 mins, then reduce the temperature to 180C/160C fan/gas 4. Continue to bake for 35-40 mins until the filling has just set. ', 'Leave to cool, then remove the pie from the tin. Mix the remaining cinnamon with the icing sugar and dust over the pie. Serve chilled.']"
Griddled chicken & corn on the cob salad,https://www.bbcgoodfoodme.com/assets/legacy/recipe/recipe-image/2012/06/griddled-chicken.jpg,Prep:15Cook:20Plusmarinating,"['4 small skinless chicken breasts', '2 garlic cloves, crushed', '1 tbsp paprika', 'juice 1 lemon', '2 tbsp olive oil', '2 corn cobs', '4 Little Gem lettuces, quartered lengthways', '½ cucumber, diced']","['  kcal 236  ', '  fat 8g  ', '  saturates 1g  ', '  carbs 12g  ', '  sugars 4g  ', '  fibre 3g  ', '  protein 28g  ', '  salt 0.2g  ']",american,"['Cut the chicken breasts in half lengthways so you are left with 8 chicken strips. Mix the garlic, paprika, lemon juice and 1 tbsp oil with some seasoning and toss with the chicken. Leave to marinate for at least 15 mins. ', 'Heat a griddle pan and brush with half the remaining oil and cook the chicken for 3-4 mins each side until cooked through. Brush over the remaining oil and griddle the corn cobs, turning to cook evenly, for about 5 mins or until lightly charred. Remove and cut off the kernels. ', 'Mix the lettuce and cucumber, top with the corn and chicken, and drizzle over your choice of dressing.']"
Key lime pie,https://www.bbcgoodfoodme.com/assets/legacy/recipe_images/key-lime-pie.jpg,Prep:25plus3hrschilling,"['300g Hob Nobs', '150g butter, melted', '1 x 397g tin condensed milk (we used Nestlé)', '3 medium egg yolks', 'finely grated zest and juice of 4 limes', '300ml double cream', '1 tbsp icing sugar', 'extra lime zest, to decorate']","['  kcal 477  ', '  fat 38g  ', '  saturates 20g  ', '  carbs 26g  ', '  sugars 22g  ', '  fibre 5g  ', '  protein 7g  ', '  salt 0.4g  ']",american,"['Heat the oven to 160C/fan 140C/gas 3. Whizz the biscuits to crumbs in a food processor (or put in a strong plastic bag and bash with a rolling pin). Mix with the melted butter and press into the base and up the sides of a 22cm loose-based tart tin. Bake in the oven for 10 minutes. Remove and cool. ', 'Put the egg yolks in a large bowl and whisk for a minute with electric beaters. Add the condensed milk and whisk for 3 minutes then add the zest and juice and whisk again for 3 minutes. Pour the filling into the cooled base then put back in the oven for 15 minutes. Cool then chill for at least 3 hours or overnight if you like. ', 'When you are ready to serve, carefully remove the pie from the tin and put on a serving plate. To decorate, softly whip together the cream and icing sugar. Dollop or pipe the cream onto the top of the pie and finish with extra lime zest. ']"
